{
  "referral": {
    "reason": "Evaluation of persistent attention and task-completion difficulty.",
    "referral_source": "school_teacher"
  },
  "comorbidity_screen": {
    "anxiety": "not_indicated",
    "depression": "not_indicated",
    "learning_disorder": "screening_recommended",
    "sleep": {
      "average_hours": 8.981844,
      "difficulty": "mild_sleep_onset_delay",
      "daytime_fatigue": "mild",
      "disorder": "not_indicated"
    }
  },
  "alternative_explanations": [
    {
      "factor": "mild_sleep_onset_delay",
      "assessment": "May contribute to fatigue but does not fully explain the cross-setting symptom pattern."
    }
  ],
  "informants": [
    {
      "role": "parent",
      "summary": "Frequent reminders are needed to complete routines and organize school materials."
    },
    {
      "role": "teacher",
      "summary": "Sustained independent work is difficult and instructions often need to be repeated."
    }
  ],
  "functional_impairment": {
    "settings": [
      "school",
      "home"
    ],
    "academic": "moderate",
    "social": "mild",
    "home": "moderate"
  },
  "symptoms": {
    "duration_months": 12,
    "onset_age_years": 7,
    "inattention": {
      "count": 7,
      "maximum": 9,
      "examples": [
        "Occasionally loses track of school materials and homework.",
        "Sometimes needs multi-step instructions repeated.",
        "Attention decreases during lengthy independent assignments."
      ]
    },
    "hyperactivity_impulsivity": {
      "count": 2,
      "maximum": 9,
      "examples": [
        "Fidgets when seated for extended periods.",
        "Occasionally interrupts group discussions."
      ]
    },
    "pattern": "persistent",
    "recent_changes": "stable"
  },
  "rating_scales": [
    {
      "instrument": "synthetic_parent_adhd_scale",
      "score": 20,
      "maximum": 27,
      "interpretation": "elevated"
    },
    {
      "instrument": "synthetic_teacher_adhd_scale",
      "score": 21,
      "maximum": 27,
      "interpretation": "elevated"
    }
  ],
  "medication": {
    "adhd_medication_status": "unmedicated",
    "medicated_during_recording": false,
    "other_medications": []
  }
}
